Question,Actual Answer,Player Answer
Dolly the sheep is an example of,gmo,cloning
They control differentiation of cells and tissues in the embryo,hormones,hox genes
Both phenotypes appear in traits that are,polygenic,incompletely dominant
Natural selection that favors the extremes,stabilizing selection,directional selection
"Glucose, galactose and fructose are an example of this",polysaccharides,lipids
Performs intracellular digestion,rough er,golgi apparatus
The phase where the nuclear envelope has been broken down into fragments,prophase,metaphase
