Question,Actual Answer,Player Answer
Dolly the sheep is an example of,gmo,cloning
They control differentiation of cells and tissues in the embryo,hormones,hormones
Both phenotypes appear in traits that are,polygenic,polygenic
Natural selection that favors the extremes,stabilizing selection,stabilizing selection
"Glucose, galactose and fructose are an example of this",polysaccharides,polysaccharides
Performs intracellular digestion,rough er,rough er
The phase where the nuclear envelope has been broken down into fragments,prophase,prophase
